title,image,description
« Brisons les limites des disciplines scientifiques pour permettre aux générations suivantes de voir le monde de façon plus réaliste »,https://img.lemde.fr/2023/03/29/0/0/4253/2835/110/73/60/0/2d85c17_1680106845701-le-monde-tribune-def-01.jpg,"Les chercheurs Bernard Lahire, Arnaud Orain et Marc-André Selosse proposent, dans une tribune au « Monde », trois axes pour rendre les formations plus interdisciplinaires."
"« Pourquoi m’a-t-on laissé me gaver de médocs, pourquoi ne m’a-t-on rien dit ? » : quand opioïdes et benzodiazépines rendent dépendants",https://img.lemde.fr/2024/12/02/0/8/9504/6336/110/73/60/0/ab33243_1733144036434-l1020727.jpg,"Douze millions de personnes en France prennent des opioïdes pour lutter contre la douleur, et quelque 10 millions des benzodiazépines, contre l’anxiété et les troubles du sommeil, avec des risques de mésusage et de dépendance. Un enjeu majeur de santé publique."
« L’Europe doit rassembler les acteurs du spatial pour consolider son économie et étendre son influence mondiale »,https://img.lemde.fr/2024/12/02/0/0/5364/3576/110/73/60/0/d13645b_1733144625902-pns-3602587.jpg,"Josef Aschbacher, directeur général de l’Agence spatiale européenne, rappelle, dans une tribune au « Monde », que le domaine spatial est source d’innovation et de richesse. Pour que l’Europe profite pleinement de son potentiel, l’Europe doit en finir avec le « cloisonnement des esprits, des talents, des budgets et des ambitions »."
"Le crotale fer-de-lance, fragile emblème de la Martinique",https://img.lemde.fr/2024/12/01/0/0/1999/1333/110/73/60/0/2476daa_1733055478828-image0.jpeg,"Autrefois omniprésent sur l’île, jusque sur son drapeau, le serpent a vu sa population s’effondrer. Mais la protection dont il bénéficie depuis 2019 semble porter ses fruits."
"Le Téléthon lance vendredi sa 38ᵉ édition, sur fond de solide espoir pour la myopathie de Duchenne et de besoins financiers décuplés",https://img.lemde.fr/2024/11/29/0/108/5784/3856/110/73/60/0/3b9c314_1732874136685-000-1mw44a.jpg,"Emaillé de plus de 23 000 animations et défis dans toute la France, le marathon télévisuel caritatif a lieu un peu plus tôt qu’à l’accoutumée, le premier week-end de décembre étant consacré à la réouverture de Notre-Dame de Paris."
Un tissu enduit de nanoparticules pour avoir moins chaud au soleil,https://img.lemde.fr/2024/11/22/0/131/1156/771/110/73/60/0/cd1f437_1732285886298-webscie-2445-vetementfroids.png,"Pour transformer des vêtements ordinaires « en outils de rafraîchissement personnel passif », des scientifiques américains les ont enduits de nanoparticules issues de coquilles d’huîtres broyées et d’un produit de contraste pour radiographies gastriques."
"Comment a évolué le recours à l’IVG, cinquante ans après le vote de la loi Veil ?",https://img.lemde.fr/2024/11/28/1/0/8192/5461/110/73/60/0/7c3ee5b_1732812620292-000-32dl7k9.jpg,"Depuis sa promulgation, en 1975, la loi a été assouplie avec l’introduction de la technique médicamenteuse et la possibilité de recourir à l’IVG en dehors des établissements de santé, facilitant l’accès à l’avortement."
Drogues et sexe : ce que l’on sait du « chemsex » en France,https://img.lemde.fr/2024/11/28/0/172/270/180/110/73/60/0/42f480c_1732786440462-8fb4d027-chemsex-drogues-sexe-nouvelles-substances-psychoactives-nps.jpg,"Dans ce post de blog, Marc Gozlan fait le point sur les risques liés à la consommation de substances psychoactives lors de relations sexuelles, un phénomène en augmentation dans notre pays."
"L’exposition « Migrations du vivant » à Bordeaux, un regard sur les animaux et les plantes en mouvement",https://img.lemde.fr/2024/11/26/11/0/3394/2262/110/73/60/0/fc23a0a_1732611226997-belle-dame-msi.jpg,Traverser la Terre ou franchir quelques dizaines de mètres : le Muséum de Bordeaux nous rappelle que le mouvement est consubstantiel à la vie et structure aussi les règnes animal et végétal.
"« Noël au balcon, Pâques au tison » : que disent les statistiques météo du dicton populaire ?",https://img.lemde.fr/2017/12/23/0/0/3000/2000/110/73/60/0/c3b372d_23099-kn4ycf.0b4jh.jpg,Un trio de spécialistes en météorologie s’est demandé si les données collectées depuis 1947 validaient le proverbe selon lequel un Pâques frisquet succède forcément à un Noël plus chaud que la moyenne.
« L’exposition indirecte à des événements catastrophiques génère un stress post-traumatique »,https://img.lemde.fr/2023/04/27/0/0/4253/2835/110/73/60/0/1f3a2c7_1682585728341-4903a4d-1680167844315-le-monde-carte-blanche-def-01.jpg,"Voir de manière régulière des images de guerre provoque des effets néfastes sur la santé mentale, en particulier lorsque les personnes y sont soumises involontairement, souligne, dans sa carte blanche au « Monde », Sylvie Chokron, en s’appuyant sur deux études récentes."
"« Recherche sur la recherche », une métascience à la française émerge",https://img.lemde.fr/2024/11/21/171/0/1024/682/110/73/60/0/2290f3d_1732197401453-meta.jpg,"« Vie des labos ». Sociologues, documentalistes, juristes, scientomètres... se sont réunis pour la première fois le 15 novembre autour de ce travail introspectif de la science."
"Le Soleil vu par Solar Orbiter, la sonde de l’Agence spatiale européenne",https://img.lemde.fr/2024/11/22/0/1659/3712/2475/110/73/60/0/4b4884e_1732286820755-three-views-of-the-sun-s-surface.jpg,"La sonde pilotée par l’Agence spatiale européenne, dévoile des clichés inédits de l’astre du jour d’une qualité, à ce jour, inégalée."
"« Au CNRS, une armée de chercheurs sont dispensés d’obligation d’enseignement. Il s’agit d’une anomalie institutionnelle »",https://img.lemde.fr/2023/03/29/0/0/4253/2835/110/73/60/0/2d85c17_1680106845701-le-monde-tribune-def-01.jpg,"Avant de penser à réformer le crédit d’impôt recherche, le professeur d’économie Dominique Foray invite, dans une tribune au « Monde », à mettre fin, d’abord, à cette dispense, qui prive les universités d’un réservoir d’enseignants."
Comment les microtubules s’auto-organisent dans les cellules,https://img.lemde.fr/2024/11/20/167/0/1689/1126/110/73/60/0/ce18188_1732114590526-morpho.jpg,"Une équipe de chercheurs a mis en évidence le fonctionnement en réseau de ces filaments tubulaires, éléments essentiels du cytosquelette."
Japon : un incendie se déclare au centre spatial lors d’un essai sur une fusée,https://img.lemde.fr/2024/11/26/0/0/3967/2645/110/73/60/0/65abd2f_2024-11-26t024738z-998034954-rc2qcbash4dm-rtrmadp-3-japan-space.JPG,"Aucun blessé n’a été signalé à la suite d’une explosion qui s’est produite lors d’un test de combustion, mardi matin, en présence de différents médias. L’incident est une nouvelle anicroche dans le programme spatial japonais."
Un record d’énergie pour des électrons accélérés dans la galaxie,https://img.lemde.fr/2024/11/25/0/11/2508/1672/110/73/60/0/8b591b2_1732541116055-hess-ii-gamma-ray-experiment-five-telescope-array.jpg,"Une équipe internationale a annoncé, lundi, un nouveau record pour des rayons cosmiques électroniques, dotés d’une énergie de 40 téraélectronvolts. C’est dix mille milliards de fois plus que l’énergie transportée par un photon de lumière visible."
Les scientifiques appelés au chevet des forêts du bassin du Congo,https://img.lemde.fr/2024/11/25/1/0/8186/5457/110/73/60/0/c2b80ee_1732531085838-000-32hq9et.jpg,"Jusqu’à présent négligé par rapport à l’Amazonie, le deuxième massif forestier tropical bénéficie enfin de programmes de recherche d’envergure. Ils doivent permettre de mieux comprendre le fonctionnement de cet important puits de carbone"
Les activités spatiales menacent-elles la haute atmosphère ?,https://img.lemde.fr/2024/11/21/556/0/2667/1778/110/73/60/0/56213b0_1732196083464-sipa-sipausa-31644332000019.jpg,"Depuis une dizaine d’années, l’espace est de plus en plus encombré par le nombre croissant d’engins envoyés sur orbite. Ces objets, qui finissent par se désintégrer en retombant sur la Terre, risquent d’endommager la haute atmosphère par leurs émissions polluantes."
Premières tentatives pour mesurer la pollution de haute atmosphère due aux engins spatiaux,https://img.lemde.fr/2024/11/25/0/0/5000/3333/110/73/60/0/701de84_1732544302968-000-36fb74m.jpg,L’Agence spatiale européenne a mis au point plusieurs programmes qui ont pour objectif d’analyser le niveau de pollution chimique de la haute atmosphère.
Le rude combat des astronomes pour se préserver des constellations de satellites,https://img.lemde.fr/2024/11/25/0/0/6036/4024/110/73/60/0/17aacd0_1732544874598-ap22040213839895.jpg,"Les projets de constellations de milliers de satellites destinés à fournir du débit Internet se concrétisent et se multiplient. En réponse, quelques instances se mobilisent timidement pour protéger les observations du ciel astronomique."
Des pêcheries vieilles de 4 000 ans découvertes dans les basses terres de Belize,https://img.lemde.fr/2024/11/22/0/100/1080/720/110/73/60/0/6c70edf_1732288904953-foto-gilson-vasconcelos-dos-santos-quilombo-do-arapemai-3.jpeg,Une période de sécheresse aurait conduit des prédécesseurs des Mayas à constituer un réseau de réservoirs pour disposer d’abondantes ressources de poissons.
"Jean-Pierre Brun, ou l’Empire romain vu par son terroir",https://img.lemde.fr/2024/11/20/971/0/10199/6799/110/73/60/0/70d7d0d_1732115204728-jp-brun-college-de-france-terencebk-10.jpg,"L’archéologue de 69 ans, qui a perdu l’usage des mots après un accident vasculaire cérébral en 2019, se distingue par ses domaines de recherche éclectiques en explorant l’économie de la Rome antique notamment par son huile, son vin ou son parfum."
"Les tonneaux d’Ozanam, l’énigme maths du « Monde » n° 35",https://img.lemde.fr/2024/02/14/0/0/3000/2000/110/73/60/0/167edfd_1707922503333-image.png,"Le mathématicien Mickaël Launay vous invite cette semaine à une récréation avec des tonneaux, du vin et du chocolat. A vous de jouer !"
Des scientifiques prennent la première image détaillée d’une étoile hors de notre galaxie,https://img.lemde.fr/2024/11/21/0/156/4687/3125/110/73/60/0/7866dce_2024-11-21t170726z-1542980900-rc2f4ba2p45g-rtrmadp-3-space-exploration-star.JPG,"Distante de 160 000 années-lumière, l’étoile WOH G64 est située dans le Grand Nuage de Magellan, une petite galaxie satellite de la nôtre. Surnommée l’« Etoile colossale » par les astronomes, elle est environ 2 000 fois plus grosse que notre Soleil."
Pourquoi l’activité physique favorise aussi le développement des neurones,https://img.lemde.fr/2024/11/19/105/0/5398/3598/110/73/60/0/2a6bdf8_1732021810115-000-8ww3x7.jpg,"« 10 000 pas et plus ». Des chercheurs du Massachusetts Institute of Technology ont montré que la pratique du sport agit sur la croissance des neurones, leur maturation et leur bon fonctionnement, notamment grâce à la production de myokines, des substances biochimiques."
"Parents de plusieurs enfants, vous avez un « chouchou », témoignez",https://img.lemde.fr/2024/11/11/0/0/5472/3648/110/73/60/0/0fa170e_2024-11-11t152444z-1679281114-rc203ba1b3wm-rtrmadp-3-europe-weather-spain-schools.JPG,"Vous avez une relation privilégiée avec l’un de vos enfants, que vous préférez. Racontez-nous."
"Mpox : les efforts commencent à « porter leurs fruits », malgré près de 60 000 cas enregistrés en Afrique",https://img.lemde.fr/2024/12/03/0/33/4617/3078/110/73/60/0/c0f2f8a_1733211155325-2024-10-05t191340z-337612361-rc2eeaafxbsq-rtrmadp-3-health-mpox-congo.JPG,"Si sept pays n’ont plus signalé de nouvelles contaminations depuis plusieurs semaines, l’Organisation mondiale de la santé maintient son plus haut niveau d’alerte concernant l’épidémie."
"Vous êtes étudiant, vous avez passé un concours post-bac pour intégrer une école de commerce ou une école d’ingénieurs. Comment avez-vous fait votre choix ? Racontez-nous",,"Ils se nomment Avenir, Advance, Geipi-Polytech ou encore Alpha, pour l’accès aux écoles d’ingénieurs post-bac ; Accès ou Sésame, notamment, pour les écoles de commerce. Comment avez-vous fait le tri devant cette offre abondante de concours ? Quelle a été votre expérience de ceux-ci ? Livrez-nous votre témoignage."
Appel à témoignages : vous avez appris l’informatique à l’école dans les années 80 sur des ordinateurs MO5 ou TO7 ? Racontez-nous,https://img.lemde.fr/2024/12/02/1002/0/5983/3988/110/73/60/0/23be3b6_1733148446909-thomson-mo5-img-1732.jpg,"Ces machines ont été déployées dans le cadre du plan « Informatique pour tous », à partir de 1985. Ces premiers cours d’ordinateur n’ont laissé aucune trace chez vous ou, au contraire, ils vous ont marqué ? Partagez votre avis et vos souvenirs."
Six cadeaux de Noël qui ont remporté nos comparatifs,https://img.lemde.fr/2024/11/29/0/0/1098/732/110/73/60/0/3748bcc_1732869091134-capture-da-a-cran-2024-11-29-093101.jpg,"Voici une sélection d’objets à offrir à Noël, allant du robot pâtissier au gaufrier en passant par la visseuse et l’antivol de vélo. Tous figurent parmi les produits élus lauréats des guides d’achat du Monde. Leurs prix démarrent à 20 euros."
Comment fonctionnent les nouveaux médicaments anti-obésité comme le Wegogy et le Mounjaro ? Comprendre en trois minutes,https://img.lemde.fr/2024/11/20/0/75/810/540/110/73/60/0/78a0def_1732118711541-comp-tile-horizon0.jpg,"Ces nouveaux traitements Wegovy (Novo Nordisk) et Mounjaro (Eli Lilly), appelés « analogues du GLP-1 », sont autorisés en France depuis octobre et novembre 2024. Ils sont qualifiés de « révolutionnaires » par certains médecins spécialistes de l’obésité."
"Au cœur des villes, le défi de l’adaptation des végétaux",https://img.lemde.fr/2024/11/16/0/8/4272/2848/110/73/60/0/f8b6838_1731749668993-bios-2501716.jpg,"« La vie cachée des plantes ». Une équipe française a mesuré les changements morphologiques de quatre plantes herbacées poussant dans la ville de Strasbourg, confrontées aux îlots de chaleur urbains, à la densité des bâtiments ou aux tontes répétées. Et constaté que certaines de ces espèces, dans certaines limites, peuvent s’adapter."
"La migration, moteur du développement culturel des chimpanzés",https://img.lemde.fr/2024/11/21/672/0/6000/4000/110/73/60/0/dff62de_1732195123273-058-2519224.jpg,"Une équipe européenne a montré que les primates non humains innovent à partir de connaissances et de comportements puisés chez leurs congénères. Comme nous, en réalité."
La « vulve de la cycliste » : maladie peu connue et encore taboue,https://img.lemde.fr/2024/11/21/0/0/5184/3456/110/73/60/0/a4f5aba_1732194894719-295cf58f-velo-vulve-cycliste-femme.jpg,"Chez la femme, la pratique intensive du cyclisme peut exposer à une pathologie du périnée : le gonflement vulvaire unilatéral."
Pourquoi les femmes sont-elles plus sensibles au froid que les hommes ?,https://img.lemde.fr/2022/12/29/0/0/4000/2666/110/73/60/0/713a509_1672304482479-000-33632mh.jpg,"Nous ne sommes pas tous égaux face aux basses températures. Cela s’explique par des raisons hormonales, mécaniques mais aussi par des choix de société, notamment de normes thermiques pensées par des hommes pour des hommes."
"L’exposition « Le Temps d’un rêve », une invitation au pays des songes",https://img.lemde.fr/2024/11/19/0/0/3000/2000/110/73/60/0/4c871f1_1732008997025-museeconfluences-letempsdunreve08-copyrightstofleth.jpg,"Le Musée des Confluences, à Lyon, organise une exposition temporaire sur le thème du rêve en convoquant différentes disciplines, des neurosciences à l’histoire, en passant par les arts."
"L’enfance se serait prolongée il y a 1,8 million d’années",https://img.lemde.fr/2024/11/15/0/283/2430/1620/110/73/60/0/d2de8aa_1731681993937-homo-fossil.jpg,"L’analyse des dents d’un fossile du genre « Homo », découvert en Géorgie, suggère un passage à l’âge adulte plus tardif, facilitant l’évolution du cerveau. Une interprétation qui fait débat."
"Les enfants, grands oubliés de la recherche contre les maladies tropicales négligées",https://img.lemde.fr/2024/11/19/0/0/5616/3744/110/73/60/0/1891446_1732008563142-000-par7148581.jpg,"L’OMS révèle, dans un rapport, les insuffisances dans le traitement de ces pathologies qui touchent les populations pauvres. A ce jour, 70 % des médicaments ne sont pas adaptés aux plus jeunes patients."
Les écogestes à l’épreuve du découragement,https://img.lemde.fr/2023/04/27/0/0/4253/2835/110/73/60/0/1f3a2c7_1682585728341-4903a4d-1680167844315-le-monde-carte-blanche-def-01.jpg,"L’adoption de ces actes individuels du quotidien est d’autant plus extensive que la croyance en leur efficacité est faible et que le soutien à des actions protestataires face au changement climatique est important, souligne la sociologue Anne Bory dans sa carte blanche au « Monde »."
Lutte contre le paludisme : une nouvelle résistance aux traitements standards observée chez les enfants,https://img.lemde.fr/2024/11/16/0/1/4132/2755/110/73/60/0/d808e5f_1731747847530-abacanewsroy-831976-015.jpg,"Selon une étude menée en Ouganda, plus de 10 % des petits patients hospitalisés pour une forme grave de cette infection parasitaire présentent une résistance aux dérivés de l’artémisinine."
Peut-on lire le journal intime de ses enfants ?,https://img.lemde.fr/2024/12/01/0/0/1279/853/110/73/60/0/5a1df8b_1733077494003-diary-3119554-1280.jpg,"Votre ado ne parle plus mais couche ses pensées sur le papier… La tentation d’ouvrir son carnet est grande, mais ce jardin secret doit le rester et participe à sa construction psychique."
Peut-on faire de son conjoint survivant son seul héritier ?,https://img.lemde.fr/2023/05/03/0/0/3000/2000/110/73/60/0/33b2fee_1683120111389-lmargent12.jpg,"Pour protéger le membre du couple qui vivra le plus longtemps, la « clause d’attribution intégrale » est une option, mais elle présente plusieurs inconvénients, détaille Caroline Emerique, notaire associée chez KL Conseil."
"Raconte-moi ta vieillesse à l’Ehpad : « J’ai décidé de venir ici, en sachant que je n’en sortirai pas »",https://img.lemde.fr/2024/11/27/572/0/5393/3595/110/73/60/0/520bd94_1732722127833-5.jpg,"« La vieillesse, c’est ce qui arrive aux gens qui deviennent vieux », écrivait Simone de Beauvoir. Comment la vieillesse est-elle vécue par les vieux ? L’Ehpad Hector-Malot, dans le Val-de-Marne, abrite ceux pour qui trois petites marches à la maison sont devenues un jour insurmontables, et qui chaque jour doivent relever l’énorme défi de se réapproprier un domicile. Le dernier."
Peut-on être en paix avec son sexe ?,https://img.lemde.fr/2024/11/30/322/0/1252/834/110/73/60/0/d55d143_1732988543325-untitled-artwork.jpg,"Taille, forme, poils… la visibilisation accentuée des vulves et des pénis est allée de pair avec une comparaison, une hiérarchisation et un jugement croissants, en premier lieu par et envers nous-mêmes, souligne Maïa Mazaurette, chroniqueuse à « La Matinale »."
"Le « journaling », ou l’écriture intime à l’ère du développement personnel",https://img.lemde.fr/2024/11/28/130/0/4488/2992/110/73/60/0/0ebde81_1732794499427-dessin-le-monde-journaling-jeanne-macaigne.jpg,"Le journal intime à l’ancienne n’a pas dit son dernier mot : 7 % de Français déclaraient en tenir un en 2020. A ces irréductibles s’ajoute une nouvelle génération de diaristes, qui se livrent sur le papier ou sur les écrans non pour se confesser, se souvenir ou méditer, mais pour faire advenir une meilleure version d’eux-mêmes. Voici venu le temps du « journaling » et de ses coachs."
Sommes-nous à l’ère des pères tendres ?,https://img.lemde.fr/2024/11/27/1001/0/3902/2601/110/73/60/0/b0a1c1e_1732706371879-kadeem-la-nyah-rose-1.jpg,"Implication dans l’accouchement et les soins du bébé, câlins corps à corps… Même lentement, la place et les comportements des pères paraissent évoluer, constate Clara Georges dans la newsletter « Darons Daronnes »."
"Cinq sorties familiales pour voir des poissons, des sirènes et des pirates, à Paris et en banlieue",https://img.lemde.fr/2024/11/22/5/0/3872/2581/110/73/60/0/46d2e4c_1732274136063-dsc-1558-a-aquarium-de-la-porte-dorei-e.JPG,"Flâner devant les bassins des aquariums pour observer des requins, méduses ou poissons-lunes : voilà une belle occupation pour enfants (et parents) curieux."
Votre partenaire a fait une IVG. Racontez-nous,https://img.lemde.fr/2024/11/28/1/0/6578/4385/110/73/60/0/a97412b_1732811886757-000-32dl7k8.jpg,Parlez-nous de votre expérience et du rôle que vous avez joué dans le cheminement menant à cette décision. Comment avez-vous vécu cette situation ?
"« Pourquoi m’a-t-on laissé me gaver de médocs, pourquoi ne m’a-t-on rien dit ? » : quand opioïdes et benzodiazépines rendent dépendants",https://img.lemde.fr/2024/12/02/0/8/9504/6336/110/73/60/0/ab33243_1733144036434-l1020727.jpg,"Douze millions de personnes en France prennent des opioïdes pour lutter contre la douleur, et quelque 10 millions des benzodiazépines, contre l’anxiété et les troubles du sommeil, avec des risques de mésusage et de dépendance. Un enjeu majeur de santé publique."
"Droit à la santé des femmes précaires : « L’AME n’est pas seulement un sujet de santé ou de migration, c’est aussi un sujet d’égalité femmes-hommes »",https://img.lemde.fr/2024/10/31/0/0/7999/5333/110/73/60/0/7ebcad8_5122327-01-06.jpg,"Un collectif d’associations dénonce, dans une tribune au « Monde », l’intention du gouvernement de durcir l’accès à l’aide médicale de l’Etat (AME), un projet dont les premières victimes seront les femmes en situation administrative précaire."
Ce que contient le projet de loi de financement de la Sécurité sociale,https://img.lemde.fr/2024/12/02/0/0/5899/3933/110/73/60/0/ca2d0ee_1733127767777-jmug241128049.jpg,"La version finale du budget de la « Sécu », qui doit être soumise à l’Assemblée nationale lundi, est le fruit d’un compromis scellé en commission mixte paritaire le 27 novembre. Les mesures qui y sont présentées ont évolué de façon significative depuis la présentation du texte initial, le 10 octobre."
Des taxis bloquent la circulation dans une trentaine de départements pour protester contre les nouveaux tarifs du transport de patients,https://img.lemde.fr/2024/12/02/0/0/7951/5300/110/73/60/0/c46f6a4_5407245-01-06.jpg,"Des opérations escargots ont commencé aux abords de Lyon, Marseille et Toulon, et sont aussi prévues à Paris pour s’opposer à la nouvelle convention en cours de négociation avec l’Assurance-maladie, dans laquelle le tarif passerait de 1,50 à 1 euro par kilomètre."
Que se passerait-il si le budget de la « Sécu » pour 2025 n’était pas approuvé ?,https://img.lemde.fr/2024/11/11/0/0/5899/3933/110/73/60/0/ea7d78e_1731343611584-jmug241106061.jpg,La chute du gouvernement sur le projet de loi de financement de la Sécurité sociale aurait des conséquences directes et indirectes qui inquiètent déjà les acteurs de la santé.
"L’épidémie de bronchiolite est bien installée en France, des pédiatres craignent un accès restreint au Beyfortus pour les familles « les plus modestes »",https://img.lemde.fr/2023/09/28/1/0/5650/3766/110/73/60/0/a32294f_1695892615999-lgeai-bronchiolite-39.jpg,"En dehors des maternités, ce traitement protégeant les bébés de cette infection des bronchioles n’est remboursé qu’à 30 %, avec un reste à charge de 280 euros."
Données de santé : une nouvelle application de Doctolib fait débat,https://img.lemde.fr/2024/11/29/0/0/5472/3648/110/73/60/0/9bac950_1732895281444-000-32ay68q.jpg,"Le leader de la prise de rendez-vous médical propose un espace permettant de réunir les données de santé d’un patient. Une offre vue par certains acteurs du secteur comme concurrente de « Mon espace santé », de l’Assurance-maladie."
"Paul Christophe, le gagnant des arbitrages du budget de la Sécurité sociale",https://img.lemde.fr/2024/11/29/0/0/3121/2081/110/73/60/0/6bbb75e_1732897552965-000-36h94hh.jpg,"Ministre des solidarités, de l’autonomie et de l’égalité entre les femmes et les hommes, cet ex-député (Horizons) du Nord obtient une hausse inédite des crédits pour les personnes âgées dans le projet de financement de la Sécurité sociale, présenté au vote lundi 2 décembre à l’Assemblée nationale."
"Sur le mercato des enseignants, les grandes écoles françaises en mal d’atouts",https://img.lemde.fr/2024/11/29/51/0/2138/1425/110/73/60/0/0a2ba41_1732859001514-le-monde-copie.jpg,"Si les universités recrutent peu d’enseignants chaque année, les grandes écoles sont en compétition sur un marché tendu, qui ressemble parfois à un véritable mercato."
"L’alerte des « universités en danger », qui manifestent pour dénoncer une « bascule vers un fonctionnement très dégradé »",https://img.lemde.fr/2024/12/02/0/0/5568/3712/110/73/60/0/b2dca66_1733156592419-000-13f924.jpg,"Les établissements français se mobilisent, mardi 3 décembre, pour mettre en garde sur leur situation. Une majorité d’entre eux devront réduire leurs capacités d’accueil, revoir leur offre de formation ou seront dans l’incapacité de remplacer les départs à la retraite, pointent leurs dirigeants, si les efforts qui leur sont demandés sont maintenus."
