title,image,description
Traité plastique : des militants de Greenpeace abordent un navire pétrochimique au large de la Corée du Sud,https://img.lemde.fr/2024/11/30/0/0/5953/3968/110/73/60/0/ca70efa_7cd2a95579824e93887e967630bbb04c-0-888119835c7040c6800c76e19431286b.jpg,"L’organisation écologiste exige que les nations acceptent de réduire la production de plastique, alors que se tiennent jusqu’à dimanche en Corée du Sud des négociations sur un traité mondial contre la pollution plastique."
Le paradis pillé des eaux ouest-africaines,https://img.lemde.fr/2024/11/29/0/0/1667/1111/110/73/60/0/740de3c_1732895455590-geopo-2447-afrique-ouest-peche-illegale-media.png,"Dotée de réserves poissonneuses exceptionnelles, la façade atlantique de l’Afrique est victime d’une surexploitation qui menace sa sécurité alimentaire."
Dominique Méda : « Nous avons l’obligation morale et politique de tirer les enseignements des catastrophes climatiques qui se succèdent »,https://img.lemde.fr/2024/11/21/0/0/6028/4018/110/73/60/0/a2fd992_1732170181400-flood-in-valencia-75.jpg,"La catastrophe climatique qui a ravagé la région de Valence, en Espagne, devrait faire l’objet d’un débat citoyen qui permettrait de corriger quelques idées fausses sur le rôle des services publics et les coûts économiques, plaide Dominique Méda dans sa chronique."
Traité plastique : le projet d’accord mentionne pour la première fois un objectif de réduction de la production,https://img.lemde.fr/2022/04/23/0/0/5118/3412/110/73/60/0/b682e87_256477310-000-1b20v4.jpg,"Une nouvelle mouture du texte reprend la proposition du Panama, soutenue par 104 pays, dont ceux de l’Union européenne, alors qu’un petit groupe d’Etats milite pour que le traité se borne à la question de la gestion des déchets et du recyclage. Les négociations doivent s’achever dimanche."
« Ressources » : comprendre les limites physiques du monde,https://img.lemde.fr/2024/11/28/219/0/346/230/110/73/60/0/e104e3f_1732777455106-9782203275980.jpg,"L’ingénieur Philippe Bihouix et le dessinateur Vincent Perriot décortiquent, en bande dessinée, des concepts scientifiques complexes en proposant un parcours intellectuel riche de références historiques et philosophiques."
Ibrahim Thiaw : « La dégradation des terres se fait à une vitesse inédite en Afrique »,https://img.lemde.fr/2024/11/29/0/0/3600/2400/110/73/60/0/a3943c6_1732875528606-063-2174448646.jpg,"Le secrétaire exécutif de la convention des Nations unies sur la lutte contre la désertification explique, dans un entretien au « Monde », l’impératif d’un plan d’urgence contre les sécheresses à l’approche de la COP16 de Riyad, qui se tient du 2 au 13 décembre."
"Inondations en Espagne : près de Valence, un mois après, un retour à la normale encore lointain",https://img.lemde.fr/2024/11/29/0/0/5472/3648/110/73/60/0/6462733_1732872950942-1-169182.jpg,"Un mois après le drame, le sud-est de l’Espagne reste sous le choc des inondations qui ont fait 230 morts et des milliards d’euros de dégâts. Les sinistrés, secours et bénévoles travaillent toujours d’arrache-pied pour un retour à la normale. A Paiporta, considérée comme l’épicentre du drame, les stigmates sont toujours bien visibles."
"« A la COP29, les négociations ont pâti des tensions géopolitiques »",https://img.lemde.fr/2024/11/25/1/0/8032/5354/110/73/60/0/dde1057_2024-11-25t050359z-1969236981-rc29bbamnw2l-rtrmadp-3-climate-cop29.JPG,"Les guerres et le montant de 300 milliards de dollars, jugé trop faible, pour soutenir les pays en développement dans la transition écologique ont cristallisé les dernières discussions de la convention, analyse, dans une tribune au « Monde », Céline Kauffmann, directrice des programmes à l’Institut du développement durable et des relations internationales."
"De Dubaï à Belem, les trois années cruciales pour l’action climatique",https://img.lemde.fr/2024/11/24/17/0/5500/3666/110/73/60/0/06659c2_2024-11-24t054801z-519511590-rc2dbba3c0r3-rtrmadp-3-climate-cop29.JPG,"Après l’épilogue en demi-teinte de la COP29 de Bakou, il reste moins de quatre ans pour tenter d’enrayer le volume des émissions de gaz à effet de serre afin de contenir le réchauffement climatique à + 1,5 °C d’ici à la fin du siècle."
Comment décarboner l’agriculture française à l’horizon 2050 : les propositions du Shift Project,https://img.lemde.fr/2024/11/29/20/0/2102/1401/110/73/60/0/8b65f8b_1732840566128-severin-millet-2024-11-28.jpg,"Le cercle de réflexion, surtout connu pour ses travaux en matière d’énergie, publie une analyse prospective des contraintes qui pèsent sur le secteur agricole et espère, malgré le contexte de tensions, ouvrir le débat sur les transitions à planifier."
"Comparatif : parmi les téléphones d’occasion, quelle marque décote le plus vite ?",https://img.lemde.fr/2018/05/18/0/0/3000/2000/110/73/60/0/22ce5d0_6441-17eaemr.00hd.jpg,"Au fil des années, les mobiles Samsung haut de gamme perdent leur valeur beaucoup plus vite que les iPhone. Mais la balance s’inverse pour les smartphones de milieu de gamme."
« Le mandat de maire se situe dans le registre du dévouement et du don de soi »,https://img.lemde.fr/2024/11/08/0/0/600/400/110/73/60/0/29e5160_1731067529266-pns-6484962.jpg,"A seize mois des élections municipales, prévues en mars 2026, le sociologue du travail Didier Demazière s’interroge, dans une tribune au « Monde », sur les raisons qui entraîneraient une crise des vocations des maires."
Ce que contient le projet de loi de financement de la Sécurité sociale,https://img.lemde.fr/2024/12/02/0/0/5899/3933/110/73/60/0/ca2d0ee_1733127767777-jmug241128049.jpg,"La version finale du budget de la « Sécu », qui doit être soumise à l’Assemblée nationale lundi, est le fruit d’un compromis scellé en commission mixte paritaire le 27 novembre. Les mesures qui y sont présentées ont évolué de façon significative depuis la présentation du texte initial, le 10 octobre."
"Le couvre-feu levé en Nouvelle-Calédonie, plus de six mois après le début des émeutes",https://img.lemde.fr/2024/12/02/0/0/7453/4968/110/73/60/0/981efd1_1733137679137-000-36hb8y4.jpg,Le couvre-feu avait été progressivement allégé dans le territoire après les émeutes mais était encore en vigueur de minuit à 5 heures du matin. L’interdiction du port ou du transport d’armes à feu « sans motif légitime » a également été levée.
Justice des mineurs : le coup d’épée dans l’eau de Gabriel Attal,https://img.lemde.fr/2024/11/29/0/0/5899/3933/110/73/60/0/8e6504e_1732860852971-jmug241128133.jpg,"Lundi 2 décembre, la proposition de loi du président du groupe Ensemble pour la République visant à durcir les dispositifs prévus « à l’égard des mineurs délinquants et de leurs parents » est examinée en séance publique à l’Assemblée nationale."
Que se passerait-il si le budget de la « Sécu » pour 2025 n’était pas approuvé ?,https://img.lemde.fr/2024/11/11/0/0/5899/3933/110/73/60/0/ea7d78e_1731343611584-jmug241106061.jpg,La chute du gouvernement sur le projet de loi de financement de la Sécurité sociale aurait des conséquences directes et indirectes qui inquiètent déjà les acteurs de la santé.
Réforme du brevet des collèges : « L’orientation n’est pas une science exacte »,https://img.lemde.fr/2024/11/28/0/0/7479/4986/110/73/60/0/383efc0_1732807476358-000-36fn7zp.jpg,"L’économiste Marc Gurgand dénonce, dans une tribune au « Monde », la fascination française pour le diplôme, illustrée par la réforme voulue du brevet, qui va entraîner un durcissement des conditions d’accès en classe de 2de."
« Fractures françaises » : « La clarification souhaitée par le président de la République n’a pas eu lieu »,https://img.lemde.fr/2024/12/02/0/0/8256/5504/110/73/60/0/f1aa40c_1733122651264-596411.jpg,"Le gouvernement n’a pas pu restaurer la confiance dans les institutions politiques, Kevin Arcenaux et Anne Muxel, directeur et directrice déléguée du Cevipof, relèvent, à partir de la douzième vague de l’enquête annuelle « Fractures françaises », réalisée par Ipsos pour « Le Monde », la Fondation Jean Jaurès, le Cevipof et l’Institut Montaigne."
Fractures françaises : « Comment vivent les Français ? »,https://img.lemde.fr/2024/12/01/0/0/5833/3888/110/73/60/0/88fae5d_1733080786973-000-34uq64v.jpg,"Le secrétaire général de la Fondation Jean Jaurès, Gilles Finchelstein, dresse un portrait des Français « à l’échelle humaine », à partir de la douzième vague de l’enquête annuelle « Fractures françaises », réalisée par Ipsos pour « Le Monde », la Fondation Jean Jaurès, le Cevipof et l’Institut Montaigne."
"Fractures françaises : des « angoisses de disparition », mais pas de « décivilisation »",https://img.lemde.fr/2024/12/01/0/13/3120/2080/110/73/60/0/d2dd381_1733079436024-000-8wj4fv.jpg,"A partir de la douzième vague de l’enquête annuelle, réalisée par Ipsos pour « Le Monde », la Fondation Jean Jaurès, le Cevipof et l’Institut Montaigne, Brice Teinturier, le directeur général délégué de l’institut de sondage, bat en brèche le « processus de décivilisation » repris par Emmanuel Macron."
"« Fractures françaises » : la jeunesse, « tantôt diabolisée, tantôt convoitée »",https://img.lemde.fr/2024/12/01/0/0/7989/5326/110/73/60/0/8b8a2e6_1733080513333-000-34wv7xa.jpg,"Blanche Leridon et Lisa Thomas-Darbois, de l’Institut Montaigne, soulignent le paradoxe d’une jeunesse perçue comme « trop favorisée » quand bien même elle est souvent la grande oubliée, selon la douzième vague de l’enquête annuelle, réalisée par Ipsos pour « Le Monde », la Fondation Jean Jaurès, le Cevipof et l’Institut Montaigne."
"La France, un pays inquiet et mécontent frappé par la crise politique",https://img.lemde.fr/2024/12/01/0/0/5228/3485/110/73/60/0/e771f7c_1733078919853-000-36j72v6.jpg,"La douzième vague de l’enquête annuelle « Fractures françaises », réalisée par Ipsos pour « Le Monde », la Fondation Jean Jaurès, le Cevipof et l’Institut Montaigne dresse le portrait d’un pays qui n’a plus confiance en son personnel politique et en ses institutions."
"Christian Le Bart, politiste : « La démocratie représentative est menacée par le populisme »",https://img.lemde.fr/2024/11/29/602/0/3291/2194/110/73/60/0/1b600ff_1732873054520-christian-le-bart.jpg,"Dans un entretien au « Monde », le spécialiste de la gouvernance locale s’inquiète de voir que le métier politique n’est guère défendu par ceux qui l’exercent, en privilégiant des stratégies de façade, qui flirtent avec l’air du temps."
"Le gouvernement français refuse de bloquer des techniques de contournement de l’impôt sur les dividendes, révélées en 2018 par « Le Monde »",https://img.lemde.fr/2018/10/18/2/308/1498/998/110/73/60/0/431bf3c_KooPILMnXBFSTMNVmv2BGC8u.png,"Des élus tentent de profiter des discussions sur le budget 2025 pour éliminer définitivement cette fraude fiscale sophistiquée, ce qui rapporterait entre 1,5 et 3 milliards d’euros de rentrées fiscales supplémentaires par an. Mais le gouvernement s’oppose à ces solutions."
Le gouvernement à la merci du chaos parlementaire,https://img.lemde.fr/2024/11/29/0/0/5899/3933/110/73/60/0/454be86_1732860928275-jmug241128068.jpg,"Dans quelles conditions le gouvernement va-t-il pouvoir faire adopter le budget de la Sécurité sociale, lundi, alors qu’il ne peut compter que sur le soutien de 36 % des députés ? Le RN, qui menace d’une censure, considère désormais que l’exécutif a « mis fin à la discussion »."
"Des appels à l’union à gauche, mais des chemins opposés",https://img.lemde.fr/2024/12/01/686/0/8272/5514/110/73/60/0/ca65a1c_1733084587871-080-hl-ebroncard-2592313.jpg,"Jean-Luc Mélenchon, Marine Tondelier, Lucie Castets et des ex- « insoumis » ont multiplié, ce week-end, les déclarations en vue de la présidentielle de 2027. Entre le leader de LFI, la chef des écologistes et le PS, tous membres du Nouveau Front populaire, les méthodes divergent."
Bonus-malus des véhicules : les aides devraient s’amenuiser et les professionnels s’alarment,https://img.lemde.fr/2024/11/26/0/0/6000/4000/110/73/60/0/4a4cd2f_1732652143503-000-36k683z.jpg,"Le bonus pour l’achat d’une voiture électrique passerait de 4 000 euros (7 000 pour les petits revenus) à 3 000, voire 2 000 euros (4 000 pour les petits revenus), alors que le « leasing social » serait maintenu mais restreint. A l’inverse, le malus au poids s’étendrait."
Volkswagen défie les SUV avec un break électrique,https://img.lemde.fr/2024/11/21/0/0/2098/1398/110/73/60/0/892e275_1732206505342-1371514c24a68821da3f24ea5875359a-2098x1399.jpg,"Sobre, cher et confortable, l’ID.7 Tourer tente de contester l’hégémonie des faux 4 × 4."
"Chez Porsche, la foi électrique vacille",https://img.lemde.fr/2024/11/21/1/0/8192/5461/110/73/60/0/f035236_1732178735725-macan-turbo-1.jpg,"En difficulté sur les marchés mondiaux, le constructeur allemand haut de gamme modère ses objectifs de décarbonation annoncés et va prolonger la carrière de ses modèles thermiques."
"Northvolt, géant des batteries électriques, se déclare en faillite",https://img.lemde.fr/2024/11/20/86/0/3024/2016/110/73/60/0/21d272d_2024-11-20t123352z-383455463-rc2z8bal4mwo-rtrmadp-3-northvolt-debt.JPG,"La société suédoise, en difficultés financières depuis le début de l’année, n’a pas réussi à lever de nouveaux financements. Elle a demandé une protection au titre du chapitre 11, la loi américaine sur les faillites."
Saint-Gobain étudie la vente des vitrages automobiles Sekurit,https://img.lemde.fr/2024/11/20/0/0/6000/4000/110/73/60/0/d8d8e08_1732094166485-2022-09-30t125106z-1334430244-rc2nrw9xudsu-rtrmadp-3-business-france.JPG,"La filiale historique, évaluée à 2,5 milliards d’euros, n’entre plus dans la stratégie du groupe : devenir le numéro un mondial de la construction durable."
Le constructeur automobile Ford annonce 4 000 nouvelles suppressions de postes en Europe,https://img.lemde.fr/2024/11/20/0/2/5221/3481/110/73/60/0/229630e_5304463-01-06.jpg,"Ces suppressions d’emplois doivent intervenir d’ici à la fin de l’année 2027, principalement en Allemagne et au Royaume-Uni, alors que les plans sociaux se multiplient chez les constructeurs et les équipementiers automobiles."
"Après Michelin, ArcelorMittal envisage la fermeture de deux sites en France",https://img.lemde.fr/2024/11/19/0/0/8256/5504/110/73/60/0/23001fb_5296767-01-06.jpg,"L’annonce pourrait provoquer la perte d’environ 130 emplois, une centaine à Reims et une trentaine à Denain, dans le Nord, ont rapporté deux syndicats. Alors que le site de Denain se met en grève immédiatement, des actions sont prévues sur tous les sites ArcelorMittal lundi et mardi."
Stellantis veut rassurer sur ses usines en France,https://img.lemde.fr/2024/11/19/0/0/8256/5504/110/73/60/0/5365f89_1731999536133-maxnewsspecialtwo056161.jpg,"A Rennes, les salariés s’inquiètent du vieillissement des équipes et de n’avoir qu’un seul modèle à produire : le SUV C5 Aircross de Citroën."
La revanche de la voiture sans permis,https://img.lemde.fr/2024/11/14/0/0/2000/1333/110/73/60/0/6650ccb_1731577904711-mobilize-duo.jpg,"Souvent électrifiés, ces véhicules accessibles dès 14 ans devraient augmenter leurs ventes de 30 % en 2024. Ce succès laisse entrevoir l’avènement d’une nouvelle catégorie de vraies petites voitures électriques meilleur marché que les « wattures » actuelles."
« Le destin de Tesla se joue dans les relations d’Elon Musk avec l’administration Trump »,https://img.lemde.fr/2024/11/12/136/0/1365/910/110/73/60/0/72b745b_1731400359709-000-36jx7xn.jpg,"Le patron de Tesla veut devenir le champion sur le terrain de la conduite autonome. Mais le développement de ce secteur est étroitement encadré aux Etats-Unis. Un carcan réglementaire que le milliardaire, attendu comme le nouveau chef de l’efficacité administrative, auprès du futur président Donald Trump, entend bien desserrer."
"A Strasbourg, les salariés de Dumarey Powerglide se mettent en grève",https://img.lemde.fr/2024/11/08/3/0/5152/3434/110/73/60/0/635afa3_1731058747374-2024-10-01t133847z-683010155-rc2pbaa9f0zc-rtrmadp-3-france-politics-protests.JPG,"Dans le contexte tendu d’un plan social, les salariés et l’entreprise qui fabrique des boîtes de vitesses haut de gamme ne sont pas parvenus à s’entendre."
Le japonais Nissan annonce une restructuration massive,https://img.lemde.fr/2024/11/07/0/0/3904/2602/110/73/60/0/cb8db40_5188578-01-06.jpg,"Face au recul de ses ventes en Chine et aux Etats-Unis, le constructeur automobile va fortement réduire ses effectifs et ses capacités de production. Son PDG diminue son salaire de moitié."
"A Cholet, les salariés de Michelin mobilisés contre la fermeture de leur usine",https://img.lemde.fr/2024/11/05/0/0/5234/3489/110/73/60/0/e4cfd01_5166809-01-06.jpg,"Depuis l’annonce, mardi 5 novembre, de la disparition du site avant 2026, les ouvriers choletais sont en grève et l’usine paralysée. A Clermont-Ferrand, siège de Michelin, la CGT appelle à une grève illimitée à compter de jeudi 7 novembre."
"Le retour de Donald Trump, mauvaise nouvelle pour la voiture électrique",https://img.lemde.fr/2024/11/07/1/0/5008/3338/110/73/60/0/815b7e0_1730998585662-ap24307744186660.jpg,Le président américain élu pourrait revenir sur les aides à l’achat ou renforcer les taxes sur les importations de véhicules chinois.
Des ouvriers chinois à Sochaux chez Stellantis,https://img.lemde.fr/2024/11/07/0/0/5848/3899/110/73/60/0/f1dbf4d_1730965571896-000-36j4968.jpg,"Le constructeur a envisagé de faire venir de Chine de 100 à 200 personnes pour l’installation du nouvel atelier peinture. Pour l’instant, une trentaine de demandes de visa ont été déposées."
"Plongée au cœur du poumon électrique de Renault, à Douai",https://img.lemde.fr/2024/11/06/0/0/4252/2835/110/73/60/0/7365829_1730902562188-andia-andia-bp131583.JPG,"Le site nordiste produit la nouvelle R5 à raison de 300 par jour. Toutes sont des voitures à batteries car Renault a choisi de spécialiser ses usines et ses modèles par motorisation, d’un côté les « wattures », de l’autre les voitures thermiques."
Procès des viols de Mazan : « Il faut alerter les consommateurs du caractère addictif de la pornographie et des dangers auxquels elle expose les femmes »,https://img.lemde.fr/2024/11/27/0/0/5160/3440/110/73/60/0/2ab8b3a_2024-11-27t164836z-623001348-rc2sdba7ecp5-rtrmadp-3-france-justice.JPG,"Le procès de Mazan doit aussi être celui du monde parallèle de certains sites de rencontre dégradants pour les femmes et de l’addiction à une pornographie qui véhicule une culture patriarcale, estiment, dans une tribune au « Monde », un collectif d’autrices engagées dans la lutte contre le sexisme et les violences sexuelles."
"La venue de Donald Trump en France pour la cérémonie de réouverture de Notre-Dame, un coup diplomatique pour Emmanuel Macron",https://img.lemde.fr/2024/12/03/0/0/5899/3933/110/73/60/0/a87f2f1_1733215033709-939532.jpg,"Le président américain élu effectuera à Paris, samedi 7 décembre, son premier déplacement à l’étranger depuis son élection le 5 novembre."
Donald Trump se rendra en France ce week-end pour assister à la réouverture de Notre-Dame,https://img.lemde.fr/2024/12/01/0/0/6009/4006/110/73/60/0/50f290b_5396772-01-06.jpg,"Une cinquantaine de chefs d’Etat et de gouvernement sont attendus à Paris, le 7 décembre, pour assister aux cérémonies, cinq ans et demi après l’incendie qui a dévasté la cathédrale."
"« En Chine, l’expression de colère en ligne sur les serviettes hygiéniques a pris un tour très politique »",https://img.lemde.fr/2024/12/02/0/239/4245/2830/110/73/60/0/02c01d9_1733148913973-gettyimages-1473812123.jpg,"Dans un pays où l’existence d’un mouvement féministe est perçue comme une menace par les autorités, la qualité défectueuse des protections menstruelles a scandalisé les femmes."
Pourquoi la prise d’Alep par les rebelles islamistes est un embarrassant revers pour la Russie,https://img.lemde.fr/2024/12/03/0/0/6720/4480/110/73/60/0/2bdeaa9_1733214088196-938853.jpg,Les frappes aériennes russes n’ont pas permis à Damas de garder le contrôle de la grande ville du Nord. La priorité de Moscou est l’Ukraine et non plus le soutien au régime de Bachar Al-Assad.
Angela Me (ONUDC) : « La menace des drogues de synthèse doit déjà être prise en considération »,https://img.lemde.fr/2024/10/21/0/0/1600/1066/110/73/60/0/e1d1b93_1729515584253-ap22330774337393-preview.jpg,"Au-delà du fentanyl, les nitazènes, opioïdes de synthèse encore plus puissants, se diffusent en Europe. Les drogues de synthèse, moins chères et plus faciles à transporter, remplaceront peu à peu les produits issus de plantes, prévient Angela Me, de l’Office des Nations unies contre la drogue et le crime dans un entretien au « Monde »."
"« A la fin, ce n’est pas la mort qui gagne, mais la noblesse d’âme » : en mémoire de Simon Fieschi, survivant de l’attentat contre « Charlie Hebdo »",https://img.lemde.fr/2024/10/19/0/0/2499/1666/110/73/60/0/d411035_5001989-01-06.jpg,"Premier de la rédaction à être touché par les tirs des frères Kouachi, il avait été grièvement blessé lors de l’attaque terroriste du 7 janvier 2015. Son corps sans vie a été retrouvé le 17 octobre. L’écrivain Yannick Haenel, qui a couvert le procès des attentats, lui rend hommage."
"Michel Klein, vétérinaire bien connu du petit écran, est mort à l’âge de 103 ans",https://img.lemde.fr/2024/10/19/0/0/3331/2221/110/73/60/0/8983064_5003550-01-06.jpg,"Cet ancien résistant était devenu dès les années 1960 une figure médiatique grâce à des émissions télévisées de sensibilisation à la cause animale, comme « 30 millions d’amis » ou « Terre, attention danger »."
"Simon Fieschi, grièvement blessé lors de l’attentat contre « Charlie Hebdo » en 2015, est mort",https://img.lemde.fr/2024/10/19/1/0/4300/2866/110/73/60/0/32d4461_1729334502693-08654855.jpg,"Alors qu’il travaillait dans les locaux du journal satirique en tant que webmaster, Simon Fieschi, 40 ans, avait été le premier de la rédaction à être touché par les tirs des frères Kouachi"
"La mort de Robert Coover, figure des lettres américaines",https://img.lemde.fr/2024/10/16/237/0/2362/1574/110/73/60/0/b459b71_1729072821268-opale-photo-opale30995-03.jpg,"L’auteur du « Bûcher de Times Square », habité sa vie durant par le souci esthétique et la recherche de la forme juste, est mort le 5 octobre, à l’âge de 92 ans."
L’écrivain chilien Antonio Skarmeta est mort,https://img.lemde.fr/2024/10/15/155/0/4302/2868/110/73/60/0/2aac8bf_5966178-01-06.jpg,"Après le coup d’Etat militaire d’Augusto Pinochet en 1973, l’auteur d’« Une ardente patience » s’est exilé en Argentine puis en Allemagne, où il a été ambassadeur du Chili dans les années 2000."
"La mort de l’italien Emilio Gabaglio, infatigable artisan du syndicalisme européen",https://img.lemde.fr/2024/10/14/32/0/2048/1365/110/73/60/0/4143d36_1728890828840-1997-03-16t120000z-97440298-pbeahumkucm-rtrmadp-3-belgium.JPG,"L’ancien secrétaire général de la Confédération européenne des syndicats s’est éteint le 7 octobre, à l’âge de 87 ans."
"Alex Salmond, ancien premier ministre écossais et fondateur du parti indépendantiste Alba, est mort",https://img.lemde.fr/2024/10/14/0/0/5004/3336/110/73/60/0/f5dc777_1728890483337-000-97g4xl.jpg,"Le défenseur passionné de l’indépendance écossaise, qui avait passé la main après l’échec du référendum de 2014, est mort le 12 octobre, à 69 ans."
« Les annonces de diminution de 4 000 enseignants par le gouvernement Barnier s’inscrivent dans un retour aux logiques sarkozystes »,https://img.lemde.fr/2024/01/05/0/0/5353/3568/110/73/60/0/6e982cf_1704458257654-sophie-rodriguez-lycei-e-berthollet-annecy-le-monde-10.jpg,"L’argument de la baisse du nombre d’élèves est mis à mal par les données du ministère de l’éducation sur le nombre des enseignants du primaire et du secondaire publics analyse, dans une tribune au « Monde », l’historien Emilien Ruiz. 32 000 professeurs manquent encore par rapport à 2007, malgré des effectifs en hausse entre 2010 et 2018."
"Dans l’enseignement, la perspective de trois jours de carence en cas d’arrêt maladie ne passe pas",https://img.lemde.fr/2024/11/04/0/0/5568/3712/110/73/60/0/93cbb42_1730738420540-000-1rf09e.jpg,"Alors que les professeurs sont moins souvent absents que la moyenne des fonctionnaires et des salariés du privé, le projet soutenu par le ministre de la fonction publique, Guillaume Kasbarian, leur paraît injuste. Et dangereux, pour un métier dont l’attractivité est déjà en berne."
Education : « Sommes-nous sûrs que le nombre moyen d’élèves par classe qui guide les arbitrages budgétaires est le bon critère ? »,https://img.lemde.fr/2015/09/01/0/0/4639/3093/110/73/60/0/6c16706_18074-1geeuun.jpg,"Le creux démographique actuel à l’école pourrait être l’occasion d’améliorer les conditions de scolarisation, affirme l’historienne Clémence Cardon-Quint dans une tribune au « Monde »."
