title,image,description
"L’école de journalisme ESJ Paris reprise par des propriétaires de médias, dont Vincent Bolloré et Rodolphe Saadé",https://img.lemde.fr/2024/11/15/0/0/5968/3979/110/73/60/0/ef2f3c2_1731676020045-000-34lf9k3.jpg,"L’Ecole supérieure de journalisme (ESJ) Paris, doyenne mondiale, qui ne fait pas partie des quatorze écoles reconnues par la profession, bénéficiera aussi de financements de la part de Bernard Arnault, Pierre Gattaz, le groupe Bayard et Marie-Hélène Dassault."
"« La musique classique, on doit apprendre à l’aimer, contrairement aux musiques commerciales » : opération séduction à l’Opéra-Comédie de Montpellier",https://img.lemde.fr/2024/11/14/258/0/3852/2568/110/73/60/0/b6673bf_1731578076498-vue-sur-la-salle.jpg,Un concert de musique classique gratuit attire près d’un millier de jeunes chaque année. L’initiative s’inscrit dans une stratégie de politique culturelle visant à fidéliser ce public.
"Patrick Hetzel, coup de barre à droite dans l’enseignement supérieur",https://img.lemde.fr/2024/11/14/0/0/5899/3933/110/73/60/0/862c4b3_1731600482297-jmug241106015.jpg,"L’ex-député Les Républicains du Bas-Rhin devenu ministre enchaîne les polémiques, assumant ses prises de position conservatrices. L’absence de projet clair pour les universités et la recherche inquiète la communauté scientifique."
Les universités franciliennes devront signer une « charte républicaine » pour toucher une subvention de la région,https://img.lemde.fr/2024/11/14/0/0/8256/5504/110/73/60/0/71fc9a1_1731575474398-000-34u32ty.jpg,"La charte, qui devait être votée vendredi 15 novembre, vise à rappeler le droit aux directions des établissements d’Ile-de-France où se mobilisent « des minorités agissantes », selon la présidente de la région, Valérie Pécresse."
Pourquoi les universités françaises décrochent dans le classement du « Times Higher Education »,https://img.lemde.fr/2020/09/02/0/384/4824/3216/110/73/60/0/034581a_806029675-_K2A3940.jpg,"En perte de vitesse dans le classement 2025 du journal britannique, les universités françaises évoquent les conséquences d’un manque de financement de la recherche."
"Ingénieur, un métier toujours aussi attractif : « Je ne pensais pas que j’aurais un si beau poste à mon âge »",https://img.lemde.fr/2024/11/11/20/0/2953/1968/110/73/60/0/1377962_1731323158087-campusp2.jpg,"La France étant confrontée à une pénurie de talents, les jeunes diplômés bénéficient d’une insertion remarquable sur le marché du travail."
"Dans les écoles d’architecture, une génération « très militante » qui dit non au béton",https://img.lemde.fr/2024/11/08/25/0/2137/1424/110/73/60/0/f57d6d5_1731070416226-ok.jpg,"Les ENSA ont fait évoluer leurs enseignements face au changement climatique. Très engagée, une nouvelle génération d’architectes questionne le monde professionnel sur ses pratiques."
« On essaie de capter les étudiants dès le début de leur cursus » : les IAE à la pêche aux alumni,https://img.lemde.fr/2024/11/01/173/0/4032/2688/110/73/60/0/693b3d3_1730470789463-iaelyon-school-of-management-d.JPG,"Si les écoles universitaires de management n’ont rien à envier aux « business schools » du secteur privé sur le plan académique ou de l’insertion professionnelle, leur réseau d’anciens élèves n’est pas encore aussi bien structuré."
"« Je veux devenir professeur, et cette vocation surprend après avoir fait l’école à la maison »",https://img.lemde.fr/2023/11/07/0/0/3543/2362/110/73/60/0/f45fb73_1699383816451-premiei-re-fois-lemonde-02.jpg,"« Premières fois » : récits de moments charnières autour du passage à l’âge adulte. Cette semaine, Nora, 22 ans, diplômée en lettres classiques, raconte comment avoir fait toute sa scolarité à domicile a éveillé chez elle la vocation de devenir professeure."
Manifestation et graffitis contre Yaël Braun-Pivet à Lyon-III : le ministre de l’enseignement supérieur fait un signalement à la justice,https://img.lemde.fr/2024/11/08/0/0/8256/5504/110/73/60/0/b20fd27_5201820-01-06.jpg,"La présidente de l’Assemblée nationale avait été visée, vendredi, par des tags et des slogans hostiles de militants propalestiniens opposés à sa venue dans l’établissement universitaire, tels que « Yaël casse-toi », « génocidaires hors de nos facs »."
Enquête sur la face cachée des classements des écoles de commerce,https://img.lemde.fr/2024/11/04/459/49/1396/931/110/73/60/0/2081f86_1730733877264-1-lt.jpg,"Vitrine d’exception pour les établissements, outil serviciel pour les étudiants, les palmarès des grandes écoles ont grandi en nombre et acquis une force de frappe indiscutable. Mais ils ont aussi déclenché une course à la performance où tous les coups sont permis… au détriment parfois de la qualité de la pédagogie, voire de la déontologie."
Yaël Braun-Pivet visée par des graffitis et des slogans hostiles de manifestants propalestiniens à l’université Lyon-III,https://img.lemde.fr/2024/11/08/0/0/7834/5223/110/73/60/0/a2ed15d_1731094940165-517731.jpg,"Plusieurs organisations de gauche, dont des syndicats étudiants, avaient dénoncé la venue de la présidente de l’Assemblée nationale, la qualifiant de « figure éminente du soutien inconditionnel aux actions criminelles de l’Etat israélien »."
"Vendée Globe : les écoles d’ingénieurs, une voie royale pour la course au large",https://img.lemde.fr/2024/11/07/0/214/5838/3892/110/73/60/0/69dab72_1730967267646-caroline-boule-portrait-3.jpg,De plus en plus de skippeurs passent par ce type de formation avant de faire de la navigation leur métier. Un bagage scientifique qui représente un atout pour briller sur les océans.
"« Sur la régulation de la tech et l’IA, l’élection de Trump met la pression sur l’UE »",https://img.lemde.fr/2024/11/12/0/66/1756/1171/110/73/60/0/36ca0d5_2024-11-12t101337z-1628844610-rc2l3ba9t6aq-rtrmadp-3-ecb-policy-holzmann.JPG,"Le retour du républicain à la Maison Blanche pourrait compliquer les projets de régulation des contenus sur Internet promus par l’Union européenne face aux géants américains du numérique, observe Alexandre Piquard, dans sa chronique au « Monde »."
Pourquoi Google est menacé de devoir se séparer de son navigateur Chrome,https://img.lemde.fr/2024/11/20/1/0/8192/5461/110/73/60/0/dfa17c8_1732119897582-142006.jpg,"L’administration Biden a rendu ses réquisitions contre le moteur de recherche, mercredi 20 novembre, mais la décision finale dépendra du juge et du nouveau président Donald Trump."
"Le gouvernement américain veut que Google vende son navigateur Chrome, le plus utilisé au monde",https://img.lemde.fr/2024/11/21/0/144/7398/4932/110/73/60/0/8b7745e_5309679-01-06.jpg,"Dans le cadre de sanctions liées à une pratique de monopole, les régulateurs américains cherchent à démanteler Google, en forçant notamment la vente du navigateur Internet le plus utilisé au monde."
Les confessions d’un agent repenti de la « désinformation » et des « messages haineux » de Wagner en Centrafrique,https://img.lemde.fr/2024/11/15/1022/0/3597/2398/110/73/60/0/d471056_1731665782401-7-mathias-benguigui-dscf9883.jpg,"Pendant huit mois, « Le Monde » et neuf médias internationaux, coordonnés par l’organisation Forbidden Stories, ont enquêté sur l’histoire du journaliste Ephrem Ngonzo et sur les ficelles de la stratégie de désinformation mise en œuvre par la Russie en Centrafrique et dupliquée par la suite au Sahel."
La Nintendo DS fête ses 20 ans : pourquoi c’est l’une des consoles les plus expérimentales de l’histoire,https://img.lemde.fr/2024/11/15/0/100/600/400/110/73/60/0/4c0e420_1731689223419-nintendo-ds.jpg,"Sortie le 21 novembre 2004, la Nintendo DS est la deuxième console la plus vendue au monde, juste derrière la PlayStation 2. Elle possède des caractéristiques et des fonctionnalités particulières, parfois étranges, qui ont encouragé la créativité des développeurs."
"Dopée par l’élection de Donald Trump, la valeur du bitcoin dépasse 95 000 dollars",https://img.lemde.fr/2017/11/06/51/0/2979/1986/110/73/60/0/ea48166_DAD06_BOSNIA-BITCOINS-_1106_11.JPG,Le marché anticipe une législation plus souple et des politiques économiques qui lui seraient favorables sous la future administration américaine.
"Influenceur, un métier qui s’internationalise mal",https://img.lemde.fr/2024/01/17/4/0/3000/2000/110/73/60/0/dc2371f_1705498385762-brosmind-influencer.jpg,"Les stars les plus suivies sur les réseaux sociaux sont rarement des célébrités nées sur le Net. Et pour cause : il leur est difficile de s’exporter hors des frontières de leur pays d’origine, constate Pauline Croquet dans sa chronique « Sous influences »."
Ce que l’on sait sur le vol des données médicales de 750 000 personnes,https://img.lemde.fr/2024/10/10/1/0/3008/2005/110/73/60/0/bd63703_1728546851755-papier-271-35.jpg,"Une plateforme commune à plusieurs établissements de santé français pourrait avoir fait l’objet d’une intrusion. Nom, prénom, date de naissance, adresse, mais aussi allergies ou prescriptions… Les données dérobées sont parfois très sensibles."
"Qui est Jay Graber, la patronne de Bluesky",https://img.lemde.fr/2024/11/19/262/0/1000/666/110/73/60/0/c31df4e_359350-3398545.jpg,"La Sino-Américaine de 33 ans est la discrète directrice générale du réseau social. Depuis l’élection présidentielle américaine et les controverses entourant X, sa plateforme apparaît comme une alternative prometteuse."
"« S.T.A.L.K.E.R. 2 », le jeu vidéo ukrainien saisissant et postapocalyptique, percuté par la guerre",https://img.lemde.fr/2024/11/20/0/150/1620/1080/110/73/60/0/0925795_1732105334505-stalker-5.jpg,"Annoncé en 2018, le jeu de GSC Game World, dont la genèse a nécessairement été bouleversée par la guerre en Ukraine, nous replonge dans la zone d’exclusion de Tchernobyl, réinventée en champ de bataille où se croisent milices et mutants."
"Bannie de TikTok, l’influenceuse Ophenya signalée à la justice par la Miviludes",https://img.lemde.fr/2024/11/20/0/0/5257/3505/110/73/60/0/c9f2b7c_1732100887550-000-33jt8lj.jpg,"La Mission interministérielle de vigilance et de lutte contre les dérives sectaires a déclenché une procédure visant la Française, suivie sur les réseaux sociaux par de nombreux jeunes fans, avec lesquels elle entretient des liens étroits."
"La Russie, accusée d’être derrière la rupture de deux câbles sous-marins en mer Baltique, juge la charge « absurde »",https://img.lemde.fr/2024/11/19/0/0/5119/3413/110/73/60/0/55f94a3_2024-11-19t094704z-151967433-rc298bas3uzb-rtrmadp-3-finland-germany-telecoms.JPG,Six pays européens dont la France ont accusé le Kremlin de mener des attaques hybrides « sans précédent par leur variété et leur ampleur » contre les pays de l’OTAN et de l’UE alliés de l’Ukraine.
"Sam Altman, patron d’OpenAI, s’engage dans l’équipe de transition du nouveau maire de San Francisco",https://img.lemde.fr/2024/11/19/71/0/3274/2182/110/73/60/0/f733206_1732046470817-063-2156972415.jpg,"Comme Elon Musk dans l’entourage du futur président Donald Trump, le directeur général de la start-up à l’origine de ChatGPT s’implique dans les affaires politiques aux côtés du nouvel élu centriste de la ville californienne, Daniel Lurie."
"« Threshold », une fable lugubre qui nous laisse à bout de souffle",https://img.lemde.fr/2024/11/19/0/150/1620/1080/110/73/60/0/73496d4_1732030883063-threshold-00.jpg,"Aussi bref que haletant, le jeu vidéo « Threshold » nous questionne sur le travail, la responsabilité individuelle et les valeurs que nous sommes prêts à sacrifier sur l’autel de l’allégeance au drapeau."
La mort de la danseuse et chorégraphe américaine Judith Jamison,https://img.lemde.fr/2024/11/12/134/0/2619/1746/110/73/60/0/15df073_1731425733027-063-gyi0059054231.jpg,"Légende de la danse, la directrice durant plus de vingt ans du Alvin Ailey American Dance Theater, à New York, est morte le 9 novembre, à l’âge de 81 ans."
Mort de l’auteur de BD Christian Godard à 92 ans,https://img.lemde.fr/2024/11/11/0/77/1264/843/110/73/60/0/06f3043_1731366916082-christian-godard-dans-les-annees-90-capture-d-ecran-youtube-pirinti-1731363744.jpg,"Le dessinateur, qui compte plus de 230 albums à son actif, avait connu le succès dans les années 1960 avec ses séries « Norbert et Kari » et « Martin Milan ». Il s’est éteint à son domicile parisien."
"Rachid Mekhloufi, légende de l’AS Saint-Etienne et du football algérien, est mort",https://img.lemde.fr/2008/04/12/17/0/512/341/110/73/60/0/ill_1034044_000_app2001100302393.jpg,"« Rachid Mekhloufi n’est plus, mais son héritage ne nous quittera jamais », écrit le club stéphanois, qui annonce la disparition, à 88 ans, du joueur qui a notamment gagné quatre titres de champion de France avec les Verts, dont le premier en 1957."
"Geneviève Grad, interprète de la fille de Ludovic Cruchot et de « Douliou douliou Saint-Tropez », est morte",https://img.lemde.fr/2024/11/08/959/0/3744/2496/110/73/60/0/409814b_5200542-01-06.jpg,"La comédienne est morte à 80 ans « au terme d’un combat courageux contre le cancer », a annoncé son mari. Elle s’était fait connaître dans les années 1960 en jouant Nicole Cruchot, dans la série de films « Le Gendarme de Saint-Tropez », avec Louis de Funès."
"L'héritage de Gustavo Gutiérrez, le prêtre de la « lutte des classes »",https://img.lemde.fr/2024/11/07/27/0/5111/3407/110/73/60/0/ba0dac0_1730991001493-ap388508324476.jpg,"Le prêtre catholique péruvien, qui est décédé le 22 octobre à l’âge de 96 ans, fut l’un des pères fondateurs de la théologie de la libération, un courant influencé par le marxisme plaçant la défense des opprimés au cœur du message de l’Eglise, et qui résonne encore aujourd’hui."
"Disparition du plasticien Daniel Spoerri, figure du nouveau réalisme",https://img.lemde.fr/2024/11/07/0/3/3051/2034/110/73/60/0/be12201_1730988541924-grk2233109.jpg,"L’artiste suisse d’origine roumaine, qui fut notamment l’initiateur de l’« eat art », s’est éteint, à l’âge de 94 ans."
Mort du peintre et sculpteur Louis Cane,https://img.lemde.fr/2024/11/07/596/0/2520/1680/110/73/60/0/306b0d5_1730991010817-bal-2028073.JPG,"L’artiste français, qui fut l’un des fondateurs du groupe Supports/Surfaces, n’a jamais cessé de faire évoluer son art, passant de la peinture à la sculpture, de l’abstraction à la figuration."
"L’artiste plasticien Daniel Spoerri, l’inventeur du « eat art », est mort",https://img.lemde.fr/2024/11/06/43/0/3500/2333/110/73/60/0/23d906f_1730929162879-2012-05-21t120000z-2015497904-bm2e85l10p401-rtrmadp-3-austria.JPG,"L’artiste suisse d’origine roumaine, figure du courant artistique du nouveau réalisme, était connu pour ses natures mortes tridimensionnelles liées à l’art de la table. Il avait 94 ans."
"Madeleine Riffaud, héroïne de la Résistance, est morte",https://img.lemde.fr/2024/11/06/1/0/7488/4992/110/73/60/0/e51c25f_1730912487632-000-36e94t2.jpg,"Engagée dès l’âge de 18 ans dans un groupe de Francs-tireurs et partisans, ses actions de combat en ont fait une figure emblématique de la Résistance. Journaliste-reporter pendant les guerres du Vietnam et d’Algérie, elle était également poétesse. Elle est morte mercredi à l’âge de 100 ans."
"La mort de Thanassis Valtinos, grande voix de la littérature grecque",https://img.lemde.fr/2024/11/06/0/0/5616/3744/110/73/60/0/a292d32_1730898130407-opaleplus-opale55080-02.jpg,"Cet écrivain rare et élégant, célébré dans son pays et traduit dans le monde entier, est mort le 30 octobre à Athènes. Il avait 91 ans."
"La mort de Bernard Manin, figure majeure de la théorie politique",https://img.lemde.fr/2024/11/05/664/0/2868/1912/110/73/60/0/153403c_1730812506750-000-1es6cs.jpg,"L’auteur de « Principes du gouvernement représentatif », directeur d’études à l’Ecole des hautes études en sciences sociales et professeur à l’université de New York, est mort le 1er novembre, à 73 ans."
"La mort de Claude Blanckaert, figure de l’histoire des sciences de l’homme",https://img.lemde.fr/2024/11/05/1066/310/2303/1535/110/73/60/0/ad941e3_1730813853805-20221118-174849.jpg,"Cet historien original, défricheur de sujets inexplorés et grand fédérateur d’entreprises collectives, est mort le 28 octobre, à 72 ans."
"Le mangaka Kazuo Umezu, créateur de « L’Ecole emportée » et de « Makoto-chan », est mort",https://img.lemde.fr/2024/11/05/21/0/2527/1684/110/73/60/0/f3ca32f_1730806406132-gettyimages-2182968518.jpg,"L’extravagant dessinateur, éminence du manga d’horreur, avait 88 ans."
"Mary Quant, minijupe et maxiculte",https://img.lemde.fr/2024/11/20/0/25/1449/966/110/73/60/0/dfb433c_359576-3397925.jpg,"Icône des années 1960, la créatrice de mode britannique morte en 2023 fait l’objet d’un riche documentaire disponible jusqu’au 31 décembre sur Arte.tv."
De la scène au disque : la sélection musicale du « Monde Afrique » #208,https://img.lemde.fr/2024/11/26/0/20/3223/2149/110/73/60/0/d57507c_1732613486074-live.jpg,"Le pianiste franco-algérien Yacine Malek, la chanteuse cap-verdienne Mayra Andrade et l’artiste marocain Walid Ben Selim publient des albums enregistrés lors de leurs concerts."
"En toute sérénité, Zaccharie Risacher a réussi ses premiers pas en NBA : « Il a un très haut potentiel »",https://img.lemde.fr/2024/11/21/0/0/5104/3403/110/73/60/0/1c066e5_2024-11-21t034216z-1400527772-mt1usatoday24811129-rtrmadp-3-nba-atlanta-hawks-at-golden-state-warriors.JPG,"Premier appelé lors de la draft de la NBA en 2024, comme Victor Wembanyama un an plus tôt, cet espoir du basket français, que « Le Monde » a rencontré, a réussi ses premiers pas avec les Atlanta Hawks. Et veut prendre le temps de construire sa carrière outre-Atlantique, comme en équipe de France."
"Chez Mamiche, Cécile Khayat et Victoria Effantin ont le levain gai",https://img.lemde.fr/2024/11/21/316/0/995/663/110/73/60/0/a4623d8_1732198394769-mamiche-web-004.jpg,"Depuis 2017, ce tandem de choc pétri de talent multiplie pains, viennoiseries et sandwichs dans la capitale. Aujourd’hui à la tête de trois boutiques, les deux entrepreneuses ont su s’imposer dans le milieu masculin de la boulange. La clé du succès ? Des produits 100 % faits maison vendus dans une atmosphère bon enfant."
"« Je ne me laisserai plus faire », sur Arte : les douces vengeances d’un duo d’héroïnes à la Thelma et Louise sur les routes du Nord",https://img.lemde.fr/2024/11/27/0/244/1431/954/110/73/60/0/0341921_1732701209851-jenemelaisseraiplusfaire-2.jpg,"Pour son premier long-métrage en solo, le réalisateur Gustave Kervern fait de Yolande Moreau et Laure Calamy de lointaines et non-violentes cousines des protagonistes du film de Ridley Scott."
"Crise des opioïdes aux Etats-Unis : la baisse du nombre de décès par overdose, un motif d’espoir",https://img.lemde.fr/2024/11/26/0/0/6000/4000/110/73/60/0/1733905_2024-11-26t120053z-929754142-rc2es2a3rdei-rtrmadp-3-drugs-fentanyl-china.JPG,"Alors que le fléau frappe le pays depuis plus de vingt ans, une diminution de la mortalité par overdose, notamment de fentanyl, est observée depuis 2023. Un reflux inattendu que la communauté scientifique peine à expliquer."
"« Small Changes » de Michael Kiwanuka, le changement dans la continuité",https://img.lemde.fr/2024/11/29/0/190/3420/2280/110/73/60/0/fa6d7b4_1732885875910-8256-copie.jpg,"Le guitariste et chanteur britannique publie un nouvel album, « Small Changes », toujours produit par Danger Mouse et Inflo, inspiré par sa paternité et la soul des années 1970."
"Design : à Paris, cinq expositions à ne pas manquer en cette fin d’année",https://img.lemde.fr/2024/11/26/90/62/3100/2067/110/73/60/0/7d791da_1732633257077-wilmotte-vw-showroom-12b-copie.jpg,"En décembre, on pousse les portes de cinq galeries parisiennes pour découvrir un hommage de Ron Arad à Jean Prouvé, le travail des designers français de l’après-guerre ou une vannerie japonaise tout en finesse."
Un apéro avec Ben Mazué : « L’amour ne fait pas dans l’humanitaire »,https://img.lemde.fr/2024/09/20/290/0/3543/2362/110/73/60/0/1313155_1726830911068-iorgis-matyassy-ben-mazuei-hd-02.jpg,"Chaque semaine, « L’Epoque » paie son coup. Après avoir posé son stéthoscope sur le cœur des autres avec le podcast « Amour jungle », le musicien de 43 ans se livre un peu plus dans « C’est l’heure », premier titre de son album « Famille », à paraître en février."
Sommes-nous à l’ère des pères tendres ?,https://img.lemde.fr/2024/11/27/1001/0/3902/2601/110/73/60/0/b0a1c1e_1732706371879-kadeem-la-nyah-rose-1.jpg,"Implication dans l’accouchement et les soins du bébé, câlins corps à corps… Même lentement, la place et les comportements des pères paraissent évoluer, constate Clara Georges dans la newsletter « Darons Daronnes »."
« Ressources » : comprendre les limites physiques du monde,https://img.lemde.fr/2024/11/28/219/0/346/230/110/73/60/0/e104e3f_1732777455106-9782203275980.jpg,"L’ingénieur Philippe Bihouix et le dessinateur Vincent Perriot décortiquent, en bande dessinée, des concepts scientifiques complexes en proposant un parcours intellectuel riche de références historiques et philosophiques."
"« Une histoire naturelle des sons », de Caspar Henderson : la chronique « philosophie » de Roger-Pol Droit",https://img.lemde.fr/2024/11/26/1691/0/3414/2276/110/73/60/0/f494190_1732583546225-pns-2482274.jpg,"L’écrivain et journaliste britannique fait le tour de la question sonore dans un livre tressant habilement la recherche et l’insolite, les récits intimes et les exposés dépaysants."
"Cinq sorties familiales pour voir des poissons, des sirènes et des pirates, à Paris et en banlieue",https://img.lemde.fr/2024/11/22/5/0/3872/2581/110/73/60/0/46d2e4c_1732274136063-dsc-1558-a-aquarium-de-la-porte-dorei-e.JPG,"Flâner devant les bassins des aquariums pour observer des requins, méduses ou poissons-lunes : voilà une belle occupation pour enfants (et parents) curieux."
"Avec « Apocalypse », Gazo publie un disque varié et tendre",https://img.lemde.fr/2024/11/29/1/0/6586/4390/110/73/60/0/00a0122_1732886556929-20241010-fifou-gazo-0040-079-copie.jpeg,"Le rappeur français, sacré meilleur artiste masculin aux Victoires de la musique, faisait écouter le 28 novembre, avant la sortie de son album, ses 15 nouveaux morceaux à son public."
« Les parents de milieu populaire ont davantage besoin d’aide que de leçons »,https://img.lemde.fr/2024/02/10/0/0/3543/2362/110/73/60/0/fec37c3_1707550980991-nanterre-gratacap-090224-16.jpeg,"Les familles issues des quartiers prioritaires, plus exposées à la précarité, se soucient de l’avenir de leurs enfants mais peinent à se faire accompagner. Un collectif rassemblant des représentants d’associations et des chercheuses appelle à repenser avec davantage d’ambition les politiques de soutien à la parentalité, dans une tribune au « Monde »."
Groupes de besoins au collège : la légalité de la réforme suspendue à une décision du Conseil d’Etat,https://img.lemde.fr/2024/11/20/0/0/8256/5504/110/73/60/0/1f6e769_1732116700168-abaca-923212-011.jpg,"Plusieurs syndicats ont contesté devant la justice administrative la mesure phare du « choc des savoirs » voulu par Gabriel Attal quand il était ministre de l’éducation, et que le gouvernement entend aujourd’hui renforcer. Selon le rapporteur public, qui demande son annulation, le texte aurait dû faire l’objet d’un décret et non d’un simple arrêté."
Calendrier Parcoursup 2025 : les dates essentielles de l’orientation postbac,https://img.lemde.fr/2024/11/20/0/0/7572/5048/110/73/60/0/195bc1d_1732117707321-000-337b9dy.jpg,Le nouveau calendrier de la plateforme d’orientation est disponible : voici les dates à connaître pour préparer sereinement son entrée dans l’enseignement supérieur.
"« Génération 2008. Qui seront-ils demain ? », sur LCP : Coline, Mohamed, Lilou, Riwan et Maël entrent en 2de",https://img.lemde.fr/2024/11/14/0/229/2422/1615/110/73/60/0/c540862_1731575585027-gc3a9nc3a9ration20083aquiseront-ilsdemain3fc389pisode5-rc3a9alisc3a9parfranc3a7oischevrc3a9.jpeg,C’est la première année de lycée pour les cinq jeunes Rennais que l’on retrouve une fois par an depuis 2020 et jusqu’en 2029 face à la caméra de François Chevré.
"Enseignants, comment se sont mis en place les groupes de besoin dans votre collège ? Racontez-nous",https://img.lemde.fr/2024/11/19/0/0/7230/4820/110/73/60/0/06d415e_1732033766777-000-36fl4tz.jpg,Parlez-nous de l’organisation retenue par votre établissement pour organiser des groupes de besoins en mathématiques et en français en 6ᵉ et 5ᵉ.
"Réforme des bourses pour les étudiants, label pour l’enseignement privé : le ministre Patrick Hetzel se donne du temps pour arbitrer",https://img.lemde.fr/2024/11/19/0/0/5899/3933/110/73/60/0/4ca433d_1732030351385-jmug241106123.jpg,"Le ministre de l’enseignement supérieur et de la recherche, contraint par un projet de loi de finances pour 2025 en berne, a présenté ses chantiers prioritaires mardi, souhaitant repartir de zéro sur un certain nombre de sujets."
